newsid,title,link,article,companyname,stockcode
1,クックパッド、横浜市と連携協定を締結--商店街の活性化や利便性の向上目指す - CNET Japan,https://japan.cnet.com/article/35161975/,クックパッドは11月5日、神奈川県横浜市と「新しい生活様式における生産者・販売者（商店街等）・消費者をつなぐ新しい買い物環境を通じた商店街等の活性化の取組に関する連携協定」を締結したと発表した。同社によると、政令指定都市との連携協定は初の試みになるという。今回の連携協定では、地域の生活の基盤であり、地域コミュニティの核として市民生活を支えている商店街を支援するため、生鮮食品EC「クックパッドマート」を活用し、商店街などの活性化および、市民生活の利便性向上を目指す。同社ではこれまでも、横浜市内でサービスを展開している。商品の受け取り場所である「マートステーション」は、市内のコンビニエンスストア、「アソビル」「セルテ関内」といった駅前の商業施設、マンションなどを市民の生活動線上の約20カ所に設置している。また、JA横浜営農経済センターみなみ集荷場、横浜市中央卸売市場、横浜南部市場など市内4カ所に共同集荷所を設け、市内の生産者や販売者、市場の仲卸など数十の出店者が出店しているという。5月には、JA横浜との連携を記念した「横浜・湘南ファーマーズマルシェ」や、大正二年創業の老舗鶏肉専門店「梅や」が参加する「地元で愛される老舗グルメ」などのオンラインマルシェを開催。さらには、横浜市中央卸売市場のまぐろ問屋「八清」による「まぐろ解体ショー＆販売会」を開催するなどしてきた。今回の連携協定の締結により、今後は横浜市と共に、生鮮宅配ボックス「マートステーション」などの広報活動や出店・販売促進の支援などで協力していくという。,クックパッド,2193
2,クックパッドが横浜市と連携協定、「新しい生活様式」に対応した買い物環境構築を推進 - Web担当者Forum,https://webtan.impress.co.jp/n/2020/11/06/38063,料理レシピサイト運営のクックパッドは、横浜市と11月5日に連携協定を結んだ、と同日発表した。新型コロナウイルスの感染拡大を受けた「新しい生活様式」に対応した買い物環境構築の取り組みを推進。同社が展開する生鮮食品EC「クックパッドマート」を活用し、商店街の活性化や市民生活の利便性向上を目指す。政令指定都市との連携協定は同社で初めて。締結したのは「新しい生活様式における生産者・販売者(商店街等)・消費者をつなぐ新しい買い物環境を通じた商店街等の活性化の取組に関する連携協定」。横浜市が商店街の活性化支援のための民間事業者の提案を募集し、クックバッドがクックパッドマートの利用を提案した。クックパッドマートは、生産者・販売者と消費者をつなぐ仕組みを開発している。連携事項は、生産者・販売者(商店街等)の販売促進支援、連携に向けた情報提供、PR▽商店街のにぎわい▽消費者の利便性向上▽空き店舗・スペースを活用した買い物環境向上－－など。クックパッドマートは、アプリで事前決済した商品を宅配ボックス「マートステーションで受け取る形式。店員や他の買い物客との接触を避けて短時間に買い物を済ませられる。,クックパッド,2193
3,レシピサービス「クックパッド」、アプリ内に送料無料の買い物機能を追加～新たな流通プラットフォームにより地域の生産者の新鮮な食材が一品から購入可能に～ - PR TIMES,https://prtimes.jp/main/html/rd/p/000000144.000027849.html,,クックパッド,2193
4,クックパッド、料理トレーニングアプリ「たべドリ」初のオンラインLABOを開催 ～レシピに頼らず料理ができるようになりたい研究生を募集～ - PR TIMES,https://prtimes.jp/main/html/rd/p/000000145.000027849.html,,クックパッド,2193
5,レシピサービス「クックパッド」がアプリ内に送料無料の買い物機能を追加 - TechCrunch Japan,https://jp.techcrunch.com/2020/10/16/cookpad/,クックパッドは10月15日、料理レシピ投稿・検索サービス「クックパッド」において、買い物機能の提供開始を発表した。同機能は現在、iOS版「クックパッド」アプリでメールアドレスまたは電話番号を登録済みの者のみ利用可能。提供エリアは東京都・神奈川県の一部地域。買い物機能は、「クックパッド」アプリ画面下部の「かいもの設定」アイコンから、利用したい受け取り場所の選択すると、初期設定が完了。以降は「かいもの」タブ、もしくはレシピページから商品を購入できる。料理に必要な買い物とレシピ検索が「クックパッド」アプリ内で完結し、レシピから数タップで料理に必要な食材を注文可能。近隣地域の生産者や市場直送の新鮮な食材を、1品から送料無料で購入できるようになる。同機能には、農作物の生産者、地域の農畜産物が集まる直売所、精肉店・豆腐店・チーズ店などの専門店、卸売市場の鮮魚・畜産・青果などの仲卸、飲食店・惣菜店などの多様な生産者が400店以上出店済み。購入した商品は、出荷当日に新鮮な状態のまま、地域に設置された生鮮宅配ボックス「マートステーション」に送付される。自分の選んだマートステーションに帰宅途中に立ち寄って商品を受け取れるため、仕事帰りにスーパーに寄る時間のない方や、買い物をする時間がない方でも利用できるとしている。マートステーションは、東京都・神奈川県を中心に約200ヵ所に設置済み。各地域に設置された共同集荷所へ近隣の生産者が商品を出荷、その日の夕方には各地のマートステーションまで配送されるため、地域の食材を高い鮮度を保ったまま届けられるとしている。「マートステーション」対象地域（一部が対象となる地域も含む）東京都: 港区、目黒区、世田谷区、渋谷区、中央区、千代田区、新宿区、文京区、墨田区、台東区、荒川区、豊島区、中野区、杉並区、三鷹市、狛江市、練馬区、板橋区、北区、江東区、品川区、大田区、武蔵野市、調布市 、江戸川区、葛飾区、足立区、西東京市、小金井市、府中市、町田市神奈川県: 高津区、宮前区、中原区、幸区、港南区、西区、多摩区、青葉区、鶴見区、神奈川区、南区、磯子区、中区、麻生区、緑区、旭区、瀬谷区、中央区、港南区、川崎区、都筑区、大和市、座間市埼玉県: 和光市、朝霞市、新座市また、総戸数100戸以上のマンションの居住者からマートステーション設置のリクエストを受け付けているという。管理組合・管理会社向けにも、オンラインでの設置申し込み・問い合わせ・資料請求を随時受け付けている。マートステーション設置に伴う初期費用・毎月の運用費用・電気代は一切かからない。設置工事も不要で、電源のある屋内であれば、どこでも設置できる。居住者のみ利用可能にするセキュリティコードや、購入者のみがQRコードでの解錠できるシステムにより、セキュリティについても安心して利用できるとしている。またマートステーションは、申し込みから3週間〜1ヵ月程度で導入可能という。小売事業者との連携も展開中で、導入費用は一切なく、日々の運用に伴うコストに関しては維持協力金制度を利用し補填できる。関連記事・1品注文OKで送料無料の生鮮食品EC「クックパッドマート」にAndroid版登場・1品注文OKで送料無料の生鮮食品EC「クックパッドマート」が本日スタート、まずは学芸大学駅周辺から・クックパッドが食品ECビジネスに参入、街のお店の“こだわり食材”をアプリで買える「クックパッドマート」発表,クックパッド,2193
6,「クックパッド」アプリに買い物機能。レシピ内の商品を1品から送料無料で購入可能 - ネットショップ担当者フォーラム,https://netshop.impress.co.jp/node/8115,クックパッドは10月15日、料理レシピ投稿・検索サービス「クックパッド」アプリに買い物機能を搭載した。ユーザーは「クックパッド」アプリ内で商品を1品から送料無料で購入できる。商品は東京都・神奈川県を中心に約200か所へ設置している生鮮宅配ボックス「マートステーション」を通じて消費者に届ける。配送希望日と受け取り場所は購入時に指定する。献立決めと買い物を同時に行い、利便性を向上レシピページの材料欄に記載されている購入可能な商品には買い物カゴのアイコンを表示、カートに追加・注文ができる。また、「かいもの」タブでは検索やカテゴリーから商品を選ぶことができる。買い物機能の使い方買い物機能の利用に際し、「クックパッド」アプリの画面下部にある「かいもの設定」アイコンから、利用したい受け取り場所を選択して、初期設定を行う必要がある。設定完了後は「かいもの」タブ、またはレシピページから商品を購入できる。現在、機能はiOS版「クックパッド」アプリにおいて、メールアドレスまたは電話番号を登録済みユーザーのみ利用可能で、東京都・神奈川県の一部地域が商品の提供エリアとなっている。生産者から出荷当日に食材が届く仕組み購入した商品は、地域の生産者や市場が各地域に設置した共同集荷所へ出荷し、そこから生鮮宅配ボックス「マートステーション」に配送する。出荷当日の夕方には配送するため、新鮮な状態で商品が届くという。ユーザーは自分の選んだ「マートステーション」に帰宅途中に立ち寄って商品を受け取れるため、仕事帰りにスーパーに寄る時間や買い物をする時間がなくても利用できる。商品の注文から受け取りまでの流れ「マートステーション」は現在、東京都・神奈川県を中心にコンビニや駅構内など約200か所に設置している。ドラッグストアやコインランドリーなど設置スペースのある小売店舗と連携を進めており、受け取り場所になることで、普段店舗や施設を利用していない利用者の来店や、飲料・その他日用品の「ついで買い」の促進につながるという。東京都・神奈川県を中心に設置されている生鮮宅配ボックス「マートステーション」買い物機能の提供開始に際し、クックパッドは次のようにコメントした。,クックパッド,2193
7,【裏ワザ料理】究極手抜き！簡単なめらか「ホワイトソース」の作り方 - ダイヤモンド・オンライン,https://diamond.jp/articles/-/251392,「クックパッド」337万を超えるレシピの中から、特に人気のある「使える裏ワザ」を、100個選び抜いた『クックパッドの裏ワザ料理ベスト100』が出版されました。かしこく”手抜き”したり、一手間ですご～く美味しくなったり、長持ち保存で”お得”になったり、家族で楽しく盛り上がったり……。クックパッド・ユーザーのキッチンで生み出された「知恵」で、毎日のお料理が楽しく、簡単に、美味しくなる一冊です。本連載では、その一部を抜粋でご紹介してまいります。”毎日の料理を楽しみにする”というミッションのもと、1998年より料理レシピ投稿・検索サービス「クックパッド」の提供を開始。現在の投稿レシピ数は337万品を超え、国内では月間約7400万人（2020年6月末）に利用されている。また、世界74ヵ国、32言語でもサービスを展開している。クックパッドの337万を超えるレシピの中から、特に人気のある「使える裏ワザ」を、100個選び抜いた『クックパッドの裏ワザ料理ベスト100』が出版されました。かしこく“手抜き”したり、一手間ですご～く美味しくなったり、長持ち保存で“お得”になったり、家族で楽しく盛り上がったり……。クックパッド・ユーザーのキッチンで生み出された「知恵」で、毎日のお料理が楽しく、簡単に、美味しくなる一冊です。今回は、究極の手抜き！簡単なめらかホワイトソースの作り方をご紹介します。【材料（1人分）】強力粉（薄力粉でも可）…大さじ2バター…大さじ1牛乳…200～250ml固形コンソメ…1個塩、こしょう…各適量【作り方】ここが裏ワザ！ 手順1 深めのフライパンに塩、こしょう以外の材料を入れる。ここが裏ワザ！ 手順2 中火にかけ、シリコン製の泡立て器またはヘラで、とろみがつくまでただひたすら混ぜ続ける（少量の場合はフォークで混ぜてもなめらかになる）。写真くらいのとろみがついたら、塩、こしょうで味を調える。手順3 お好みの料理に使う。【ポイント】牛乳の量によって濃度を変えることで、料理の幅が広がる。例えば、牛乳を減らしてクリームコロッケに、牛乳を増やしてスープにするなど。このレシピ以外にも、『クックパッドの裏ワザ料理ベスト100』には、たくさんの「知恵」が掲載されています。ぜひ、ご参考ください。きっと、毎日の料理が、もっと楽しくなります！,クックパッド,2193
8,免疫力アップに最適！秋の味覚きのことクックパッド料理好き社員が教える簡単料理SP！／ソレダメ！～あなたの常識は非常識！？～ | テレ東からのお知らせ - テレビ東京,https://www.tv-tokyo.co.jp/information/2020/10/28/222481.html,テレビ東京では、「ソレダメ！～あなたの常識は非常識！？～」を水曜日（不定期）に放送しています。今夜の放送は「免疫力アップに最適！秋の味覚きのことクックパッド料理好き社員が教える簡単料理SP」！ゲストにアンミカを迎え、旬のきのこのソレマル技や激ウマレシピを伝授！クックパッドの新常識のコーナーでは、料理が大好きな社員さんが紹介する超マニアックで絶品なレシピをご紹介！出演者全員で人気料理の検索ランキングを当てるドボンクイズも！そして、ソレダメ！の番組公式SNSが開設しました！TwitterとInstagramそれぞれで番組で紹介したソレマル技やレシピ、裏話などを投稿します！【出演者コメント】Q.今までスタジオ・ロケで食べた中で「もう一度食べたい！」「家でも作りたい！」おすすめしたい料理は？若林：「うますぎる！！」と感動した”新高島平・あぺたいとの焼きそば”とよく行くお店”幡ヶ谷・你好（ニーハオ）の水餃子”真麻：思わずOA後に家で作った”麻布十番・新興苑の豚キムチ”と味噌汁の新常識で紹介した”ピーマンとトマトのお味噌汁”は、トマトもお味噌汁の具材になるんだと驚きでした！春日：”あぺたいとの焼きそば”と、レンコンロケに行った時に農家で食べた、みずみずしいレンコンのきんぴら！本当に美味しかった！小籔：”あぺたいとの焼きそば”は、ご主人が「焼きそばは、炒めるのではなく焼くんです！」と言ったその言葉にしびれました！レンコンパウダーやゼリーみたいなみかんなど、VTRで見たものをよくお取り寄せしています！増田：大根のロケで行った時に農家さんに食べさせてもらった「大根の葉っぱで作ったふりかけ」。僕の中でトップオブソレマルレシピだと思います！＼今後、公式アカウントでもレシピの投稿があるかも？ぜひ、楽しみに/今夜6時25分放送！『免疫力アップに最適！秋の味覚きのことクックパッド料理好き社員が教える簡単料理SP！』「今すぐ試したくなるソレマル新常識」「メガネがくもらなくなるワザ」や「ロールケーキがキレイに切れるワザ」、今が旬の「ぶどうの皮を一気に簡単に抜いちゃうワザ」など日常の生活で役立つワザを一挙大公開！！「爆ウケカンパニー クックパッドの新常識」料理のレシピ投稿・検索サービス「クックパッド」。料理大好きな社員さんが紹介する超マニアックで絶品なレシピをご紹介！そして！番組恒例のビリビリ「ドボンクイズ」。出演者全員で人気料理の検索ランキングをビクビクしながら予想します！「今が旬！きのこの新常識」実は免疫力アップの食材として注目を集めている「きのこ」。旬のこの季節、きのこ農家さん直伝！失敗知らずのきのこ料理のソレマル技や幻の超激レアきのこを見つけに過酷ロケを遂行！ミシュラン料理人が教える絶品激ウマきのこの炊き込みごはんの作り方もご紹介！「知れば納得！からだの不思議新常識」「なぜ？恐怖を感じると顔が青ざめるのか！？」や「カラオケで歌う時、マイクを持ってない手を動かしてしまうのか！？」など今回も人間のからだの不思議を検証しちゃいます！＜番組概要＞【番組名】「ソレダメ！～あなたの常識は非常識！？～」【放送日時】2020年10月28日（水）夜6時25分～【放送局】テレビ東京、テレビ北海道、テレビ愛知、テレビ大阪、テレビせとうち、TVQ九州放送【出演】MC：若林正恭（オードリー）、高橋真麻レギュラー：春日俊彰（オードリー）ゲスト：アンミカ・小籔千豊・増田貴久VTRゲスト：原田龍二・丸山桂里奈ナレーター：服部伴蔵門【SNS】Twitter：@soredame_7chInstagram：instagram.com/soredame_7ch/関連サイトはコチラ,クックパッド,2193
